{
	"$schema": "../../schemas/infra-v2.schema.json",
	"id": "cloudfront",
	"chismografo": {
		"tipo": 4,
		"version": "1.0.0",
		"ultimaActualizacion": "2026-09-11",
		"revision": 0,
		"entorno": 2
	},
	"acercaDe": {
		"detallesGenerales": {
			"nombre": "Amazon CloudFront",
			"web": "https://aws.amazon.com/cloudfront",
			"categoria": "CDN / Proxy",
			"logo": {
				"id": "aws.amazon.com",
				"proveedor": "logodev"
			}
		},
		"precios": []
	},
	"herramienta": {
		"reglasDeteccion": [
			{
				"tipo": "header",
				"llave": "x-amz-cf-id",
				"patron": ".*",
				"descripcion": "Amazon CloudFront request ID header present"
			},
			{
				"tipo": "header",
				"llave": "via",
				"patron": "cloudfront",
				"descripcion": "Via header contains cloudfront"
			}
		]
	}
}
