{
	"$schema": "../schemas/infra-v2.schema.json",
	"id": "{{slug}}",
	"chismografo": {
		"tipo": 4,
		"version": 1.0,
		"ultimaActualizacion": "{{fechaActualizacion}}",
		"revision": 0,
		"entorno": 0
	},
	"acercaDe": {
		"detallesGenerales": {
			"nombre": "{{nombre}}",
			"categoria": "{{categoria}}",
			"web": "{{web}}",
			"logo": {
				"id": "{{id_logo}}",
				"proveedor": "local"
			}
		},
		"precios": []
	},
	"herramienta": {
		"reglasDeteccion": [
			{
				"tipo": "header",
				"llave": "server",
				"patron": "{{slug}}",
				"descripcion": "Cabecera de servidor de {{nombre}} detectada"
			}
		]
	}
}
