{
	"$schema": "../../schemas/infra-v2.schema.json",
	"id": "varnish",
	"chismografo": {
		"tipo": 4,
		"version": "1.0.0",
		"ultimaActualizacion": "2026-09-11",
		"revision": 0,
		"entorno": 2
	},
	"acercaDe": {
		"detallesGenerales": {
			"nombre": "Varnish",
			"web": "https://varnish-cache.org",
			"categoria": "CDN / Proxy",
			"logo": {
				"id": "varnish-cache.org",
				"proveedor": "logodev"
			}
		},
		"precios": []
	},
	"herramienta": {
		"reglasDeteccion": [
			{
				"tipo": "header",
				"llave": "via",
				"patron": "varnish",
				"descripcion": "Via header contains varnish cache"
			},
			{
				"tipo": "header",
				"llave": "x-varnish",
				"patron": ".*",
				"descripcion": "X-Varnish ID header present"
			}
		]
	}
}
