{
	"$schema": "../../schemas/infra-v2.schema.json",
	"id": "apache",
	"chismografo": {
		"tipo": 4,
		"version": "1.0.0",
		"ultimaActualizacion": "2026-09-11",
		"revision": 0,
		"entorno": 2
	},
	"acercaDe": {
		"detallesGenerales": {
			"nombre": "Apache",
			"web": "https://httpd.apache.org",
			"categoria": "Servidor Web",
			"logo": {
				"id": "apache.org",
				"proveedor": "logodev"
			}
		},
		"precios": []
	},
	"herramienta": {
		"reglasDeteccion": [
			{
				"tipo": "header",
				"llave": "server",
				"patron": "apache",
				"descripcion": "Server header contains 'apache'"
			}
		]
	}
}
