{
	"$schema": "../../schemas/infra-v2.schema.json",
	"id": "cloudflare",
	"chismografo": {
		"tipo": 4,
		"version": "1.0.0",
		"ultimaActualizacion": "2026-09-11",
		"revision": 0,
		"entorno": 2
	},
	"acercaDe": {
		"detallesGenerales": {
			"nombre": "Cloudflare",
			"web": "https://www.cloudflare.com",
			"categoria": "CDN / Proxy",
			"logo": {
				"id": "cloudflare.com",
				"proveedor": "logodev"
			}
		},
		"precios": []
	},
	"herramienta": {
		"reglasDeteccion": [
			{
				"tipo": "header",
				"llave": "server",
				"patron": "cloudflare",
				"descripcion": "Server header contains 'cloudflare'"
			},
			{
				"tipo": "header",
				"llave": "cf-ray",
				"patron": ".*",
				"descripcion": "Cloudflare Ray ID header present"
			}
		]
	}
}
