{
	"$schema": "../../schemas/infra-v2.schema.json",
	"id": "fastly",
	"chismografo": {
		"tipo": 4,
		"version": "1.0.0",
		"ultimaActualizacion": "2026-09-11",
		"revision": 0,
		"entorno": 2
	},
	"acercaDe": {
		"detallesGenerales": {
			"nombre": "Fastly",
			"web": "https://www.fastly.com",
			"categoria": "CDN / Proxy",
			"logo": {
				"id": "fastly.com",
				"proveedor": "logodev"
			}
		},
		"precios": []
	},
	"herramienta": {
		"reglasDeteccion": [
			{
				"tipo": "header",
				"llave": "x-served-by",
				"patron": "cache-",
				"descripcion": "Served by Fastly cache header"
			},
			{
				"tipo": "header",
				"llave": "x-cache",
				"patron": "HIT|MISS",
				"descripcion": "Fastly cache status header"
			}
		]
	}
}
